target_chembl_id,target_organism,document_journal,document_year,activity_id,standard_type,molecule_pref_name,target_pref_name,assay_chembl_id,bao_format,pchembl_value,assay_description
CHEMBL3251,Homo sapiens,None,None,3672731,Potency,None,Nuclear factor NF-kappa-B p105 subunit,CHEMBL1613823,BAO_0000019,6.8,PUBCHEM_BIOASSAY: qHTS Assay for Identification of Small Molecule Agonists for NFkB Signaling Pathway. (Class of assay: confirmatory) [Related pubchem assays: 895 ]
CHEMBL3251,Homo sapiens,None,None,4586012,Potency,None,Nuclear factor NF-kappa-B p105 subunit,CHEMBL1614274,BAO_0000019,6.8,PUBCHEM_BIOASSAY: qHTS Assay for Identification of Small Molecule Antagonists for NFkB Signaling Pathway. (Class of assay: confirmatory) 
CHEMBL4372,Bacillus anthracis,None,None,4634769,Potency,None,Anthrax lethal factor,CHEMBL1613797,BAO_0000019,6.9,PUBCHEM_BIOASSAY: qHTS Assay for Anthrax Lethal Toxin Internalization. (Class of assay: confirmatory) 
CHEMBL1293256,Homo sapiens,None,None,4813349,Potency,None,Thrombopoietin,CHEMBL1614086,BAO_0000019,5.5,PUBCHEM_BIOASSAY: qHTS Assay for Identification of Small Molecule Agonists for Thrombopoietin (TPO) Signaling Pathway. (Class of assay: confirmatory) [Related pubchem assays: 918 ]
CHEMBL1293256,Homo sapiens,None,None,5074302,Potency,None,Thrombopoietin,CHEMBL1614034,BAO_0000019,5.5,PUBCHEM_BIOASSAY: qHTS Assay for Identification of Small Molecule Antagonists for Thrombopoietin (TPO) Signaling Pathway. (Class of assay: confirmatory) [Related pubchem assays: 917 ]
CHEMBL3356,Homo sapiens,None,None,6003627,AC50,None,Cytochrome P450 1A2,CHEMBL1741322,BAO_0000019,4.5,PUBCHEM_BIOASSAY: Cytochrome panel assay with activity outcomes. (Class of assay: other) Panel member name: p450-cyp1a2 Compounds with AC50 equal or less than 10 uM are considered active
