target_chembl_id,target_organism,document_journal,document_year,activity_id,standard_type,molecule_pref_name,target_pref_name,assay_chembl_id,bao_format,pchembl_value,assay_description
CHEMBL613984,Homo sapiens,Bioorg. Med. Chem.,2015,15750326,IC50,None,IGROV-1,CHEMBL3632096,BAO_0000219,4.97,Antiproliferative activity against human IGROV1 cells assessed as cell viability incubated for 72 hrs by coulter counter method
CHEMBL3879801,None,Bioorg. Med. Chem.,2015,15750942,IC50,None,NON-PROTEIN TARGET,CHEMBL3632097,BAO_0000219,5.82,Antiproliferative activity against human IGROV1/Pt1 cells assessed as cell viability incubated for 72 hrs by coulter counter method
CHEMBL394,Homo sapiens,Bioorg. Med. Chem.,2015,15750965,IC50,None,HCT-116,CHEMBL3632098,BAO_0000219,6.29,Antiproliferative activity against human HCT116 cells assessed as cell viability incubated for 72 hrs by coulter counter method
CHEMBL325,Homo sapiens,Bioorg. Med. Chem.,2015,15750972,IC50,None,Histone deacetylase 1,CHEMBL3632099,BAO_0000357,5.98,Inhibition of HDAC1 (unknown origin) incubated for 1 hr by fluor de lys substrate based fluorescence method
CHEMBL1865,Homo sapiens,Bioorg. Med. Chem.,2015,15750978,IC50,None,Histone deacetylase 6,CHEMBL3632100,BAO_0000357,5.0,Inhibition of HDAC6 (unknown origin) incubated for 1 hr by fluor de lys substrate based fluorescence method
CHEMBL3192,Homo sapiens,Bioorg. Med. Chem.,2015,15750984,IC50,None,Histone deacetylase 8,CHEMBL3632101,BAO_0000357,5.79,Inhibition of HDAC8 (unknown origin) incubated for 1 hr by fluor de lys substrate based fluorescence method
