target_chembl_id,target_organism,document_journal,document_year,activity_id,standard_type,molecule_pref_name,target_pref_name,assay_chembl_id,bao_format,pchembl_value,assay_description
CHEMBL612545,None,J. Med. Chem.,2010,3120513,Ki,None,Unchecked,CHEMBL1073033,BAO_0000019,10.05,Inhibition of HCV1b BK full length NS3/4A protease expressed in Escherichia coli after 1 hr by time-resolved fluorescence assay
CHEMBL612545,None,J. Med. Chem.,2010,3120524,Ki,None,Unchecked,CHEMBL1073034,BAO_0000019,8.29,Inhibition of HCV JFH-1 full length NS3/4A protease expressed in Escherichia coli after 1 hr by time-resolved fluorescence assay
CHEMBL379,Hepatitis C virus,J. Med. Chem.,2010,3120538,IC50,None,Hepatitis C virus,CHEMBL1073035,BAO_0000218,8.15,Antiviral activity against HCV Con1 infected in human HuH7 cells assessed as inhibition of viral replication after 24 hrs by replicon assay in presence of 10% fetal bovine serum
CHEMBL379,Hepatitis C virus,J. Med. Chem.,2010,3120547,IC50,None,Hepatitis C virus,CHEMBL1064411,BAO_0000218,7.7,Antiviral activity against HCV JFH-1 infected in human HuH7 cells assessed as inhibition of viral replication after 24 hrs by replicon assay in presence of 10% fetal bovine serum
CHEMBL379,Hepatitis C virus,J. Med. Chem.,2010,3120573,IC50,None,Hepatitis C virus,CHEMBL1064409,BAO_0000218,7.07,Antiviral activity against HCV Con1 infected in human HuH7 cells assessed as inhibition of viral replication after 24 hrs by replicon assay in presence of 50% normal human serum
