target_chembl_id,target_organism,document_journal,document_year,activity_id,standard_type,molecule_pref_name,target_pref_name,assay_chembl_id,bao_format,pchembl_value,assay_description
CHEMBL1293235,Homo sapiens,None,None,3625088,Potency,None,Prelamin-A/C,CHEMBL1614544,BAO_0000019,4.5,PUBCHEM_BIOASSAY: qHTS Assay for Modulators of Lamin A Splicing. (Class of assay: confirmatory) 
CHEMBL361,Saccharomyces cerevisiae,None,None,3807658,Potency,None,Saccharomyces cerevisiae,CHEMBL1614414,BAO_0000218,4.65,PUBCHEM_BIOASSAY: qHTS Assay for Small Molecule Inhibitors of Mitochondrial Division or Activators of Mitochondrial Fusion. (Class of assay: confirmatory) 
CHEMBL1293232,Homo sapiens,None,None,3871418,Potency,None,Survival motor neuron protein,CHEMBL1613842,BAO_0000019,5.75,PUBCHEM_BIOASSAY: qHTS Assay for Enhancers of SMN2 Splice Variant Expression. (Class of assay: confirmatory) 
CHEMBL1293231,Mus musculus,None,None,4088974,Potency,None,Nuclear receptor ROR-gamma,CHEMBL1614441,BAO_0000019,4.65,PUBCHEM_BIOASSAY: VP16 counterscreen qHTS for inhibitors of ROR gamma transcriptional activity. (Class of assay: confirmatory) 
CHEMBL1293231,Mus musculus,None,None,4797957,Potency,None,Nuclear receptor ROR-gamma,CHEMBL1614087,BAO_0000019,4.7,PUBCHEM_BIOASSAY: qHTS for inhibitors of ROR gamma transcriptional activity. (Class of assay: confirmatory) 
CHEMBL612545,None,None,None,14402156,AC50,None,Unchecked,CHEMBL3214853,BAO_0000219,4.45,PubChem BioAssay. MLPCN PGC1a Modulators Measured in Cell-Based System Using Plate Reader - 2139-01_Inhibitor_Dose_CherryPick_Activity.   (Class of assay: confirmatory) 
