target_chembl_id,target_organism,document_journal,document_year,activity_id,standard_type,molecule_pref_name,target_pref_name,assay_chembl_id,bao_format,pchembl_value,assay_description
CHEMBL5541,Plasmodium falciparum,J. Med. Chem.,2010,3402175,IC50,None,Histone deacetylase,CHEMBL1219552,BAO_0000357,6.54,Inhibition of Plasmodium falciparum HDAC1
CHEMBL2093865,Homo sapiens,J. Med. Chem.,2010,3402180,IC50,None,Histone deacetylase,CHEMBL1219537,BAO_0000224,6.79,Inhibition of HDAC in human HeLa cell nuclear extracts
CHEMBL3192,Homo sapiens,J. Med. Chem.,2010,3402186,IC50,None,Histone deacetylase 8,CHEMBL1219538,BAO_0000357,6.21,Inhibition of HDAC8
CHEMBL612545,None,J. Med. Chem.,2010,3402192,IC50,None,Unchecked,CHEMBL1219539,BAO_0000219,7.76,Selectivity ratio IC50 for HDAC8 to IC50 for HDAC in human HeLa cells nuclear extract
CHEMBL1865,Homo sapiens,J. Med. Chem.,2010,3402198,IC50,None,Histone deacetylase 6,CHEMBL1219540,BAO_0000357,5.72,Inhibition of HDAC6
