target_chembl_id,target_organism,document_journal,document_year,activity_id,standard_type,molecule_pref_name,target_pref_name,assay_chembl_id,bao_format,pchembl_value,assay_description
CHEMBL1963,Homo sapiens,None,None,3938363,Potency,None,Thyroid stimulating hormone receptor,CHEMBL1614361,BAO_0000019,4.8,PUBCHEM_BIOASSAY: qHTS Assay for Agonists of the Thyroid Stimulating Hormone Receptor. (Class of assay: confirmatory) 
CHEMBL4372,Bacillus anthracis,None,None,4635045,Potency,None,Anthrax lethal factor,CHEMBL1613797,BAO_0000019,8.1,PUBCHEM_BIOASSAY: qHTS Assay for Anthrax Lethal Toxin Internalization. (Class of assay: confirmatory) 
CHEMBL1963,Homo sapiens,None,None,4707388,Potency,None,Thyroid stimulating hormone receptor,CHEMBL1614281,BAO_0000019,4.8,PUBCHEM_BIOASSAY: qHTS Assay for Agonists of the Thyroid Stimulating Hormone Receptor: Activators of Intracellular cAMP Concentrations in Parental HEK 293. (Class of assay: confirmatory) 
CHEMBL340,Homo sapiens,None,None,4949522,Potency,None,Cytochrome P450 3A4,CHEMBL1614108,BAO_0000357,4.9,PUBCHEM_BIOASSAY: qHTS Assay for Activators of Cytochrome P450 3A4. (Class of assay: confirmatory) [Related pubchem assays: 410 ]
CHEMBL340,Homo sapiens,None,None,5018443,Potency,None,Cytochrome P450 3A4,CHEMBL1613886,BAO_0000357,4.9,PUBCHEM_BIOASSAY: qHTS Assay for Inhibitors and Substrates of Cytochrome P450 3A4. (Class of assay: confirmatory) [Related pubchem assays: 410 ]
CHEMBL340,Homo sapiens,None,None,6062055,AC50,None,Cytochrome P450 3A4,CHEMBL1741324,BAO_0000019,4.9,PUBCHEM_BIOASSAY: Cytochrome panel assay with activity outcomes. (Class of assay: other) Panel member name: p450-cyp3a4 Compounds with AC50 equal or less than 10 uM are considered active
