target_chembl_id,target_organism,document_journal,document_year,activity_id,standard_type,molecule_pref_name,target_pref_name,assay_chembl_id,bao_format,pchembl_value,assay_description
CHEMBL364,Plasmodium falciparum,J. Med. Chem.,2011,6199023,IC50,None,Plasmodium falciparum,CHEMBL1775722,BAO_0000218,6.65,Antimalarial activity against multidrug-resistant Plasmodium falciparum TM91C235 after 48 hrs by [3H]hypoxanthine incorporation assay
CHEMBL364,Plasmodium falciparum,J. Med. Chem.,2011,6199057,IC50,None,Plasmodium falciparum,CHEMBL1775723,BAO_0000218,6.18,Antimalarial activity against chloroquine-sensitive Plasmodium falciparum D6 after 48 hrs by [3H]hypoxanthine incorporation assay
CHEMBL364,Plasmodium falciparum,J. Med. Chem.,2011,6199728,IC50,None,Plasmodium falciparum,CHEMBL1775724,BAO_0000218,6.75,Antimalarial activity against chloroquine/pyrimethamine-resistant Plasmodium falciparum W2 after 48 hrs by [3H]hypoxanthine incorporation assay
CHEMBL614245,Homo sapiens,J. Med. Chem.,2011,6199751,IC50,None,THP-1,CHEMBL1775725,BAO_0000219,5.16,Cytotoxicity against human THP1 cells after 1 to 4 hrs by MTS assay
CHEMBL395,Homo sapiens,J. Med. Chem.,2011,6199899,IC50,None,HepG2,CHEMBL1775726,BAO_0000219,4.85,Cytotoxicity against human HepG2 cells after 1 to 4 hrs by MTS assay
